{
  "name": "paintnine",
  "title": "paintnine",
  "description": "Make generative art with plotnine — a Python grammar of graphics library.",
  "logo_url": "https://github.com/isabelizimm.png",
  "repo_url": "https://github.com/isabelizimm/paintnine",
  "bug_reports_url": "https://github.com/isabelizimm/paintnine/issues",
  "pypi_url": "https://pypi.org/project/paintnine/",
  "last_updated": "2023-01-12",
  "maintainers": [
    {
      "name": "Isabel Zimmermann",
      "social_media": [{
        "github": "isabelizimm"
      }]
    }
  ]
}
