{
  "name": "tributors",
  "title": "tributors",
  "description": "Give tribute to your repository contributors — generates contributor files like .all-contributorsrc and CITATION.cff.",
  "logo_url": "https://github.com/vsoch.png",
  "repo_url": "https://github.com/con/tributors",
  "bug_reports_url": "https://github.com/con/tributors/issues",
  "pypi_url": "https://pypi.org/project/tributors/",
  "last_updated": "2023-06-07",
  "maintainers": [
    {
      "name": "Vanessa Sochat",
      "social_media": [{
        "github": "vsoch"
      }]
    },
    {
      "name": "yarikoptic",
      "pyladies": false,
      "social_media": [{
        "github": "yarikoptic"
      }]
    }
  ]
}
