{
  "name": "matcouply",
  "title": "matcouply",
  "description": "Python library for fitting coupled matrix and tensor factorizations — regularized AO-ADMM decompositions for coupled data.",
  "logo_url": "https://github.com/MarieRoald.png",
  "repo_url": "https://github.com/MarieRoald/matcouply",
  "bug_reports_url": "https://github.com/MarieRoald/matcouply/issues",
  "pypi_url": "https://pypi.org/project/matcouply/",
  "last_updated": "2026-02-08",
  "maintainers": [
    {
      "name": "Marie Roald",
      "social_media": [{
        "github": "MarieRoald"
      }]
    }
  ]
}
