{
  "name": "conda-store-server",
  "title": "conda-store-server",
  "description": "Server component of conda-store — manages conda environment builds and serves them to users.",
  "logo_url": "https://github.com/pavithraes.png",
  "repo_url": "https://github.com/conda-incubator/conda-store",
  "bug_reports_url": "https://github.com/conda-incubator/conda-store/issues",
  "pypi_url": "https://pypi.org/project/conda-store-server/",
  "last_updated": "2025-02-11",
  "maintainers": [
    {
      "name": "Pavithra Eswaramoorthy",
      "social_media": [{
        "github": "pavithraes"
      }]
    },
    {
      "name": "trallard",
      "social_media": [{
        "github": "trallard"
      }]
    },
    {
      "name": "peytondmurray",
      "social_media": [{
        "github": "peytondmurray"
      }]
    }
  ]
}
