{
  "name": "cspobject",
  "title": "cspobject",
  "description": "An object-oriented representation of Content Security Policies for Python.",
  "logo_url": "https://github.com/excitedleigh.png",
  "repo_url": "https://github.com/adambrenecki/cspobject",
  "bug_reports_url": "https://github.com/adambrenecki/cspobject/issues",
  "pypi_url": "https://pypi.org/project/cspobject/",
  "last_updated": "2017-09-07",
  "maintainers": [
    {
      "name": "Daisy Leigh Brenecki",
      "social_media": [{
        "github": "excitedleigh"
      }]
    }
  ]
}
