{
  "name": "dask-bigquery",
  "title": "dask-bigquery",
  "description": "Dask integration for Google BigQuery via the BigQuery Storage API — supports reading and writing data with Dask.",
  "logo_url": "https://github.com/ncclementi.png",
  "repo_url": "https://github.com/coiled/dask-bigquery",
  "bug_reports_url": "https://github.com/coiled/dask-bigquery/issues",
  "pypi_url": "https://pypi.org/project/dask-bigquery/",
  "last_updated": "2024-07-25",
  "maintainers": [
    {
      "name": "Naty Clementi",
      "social_media": [{
        "github": "ncclementi"
      }]
    },
    {
      "name": "Jim Bourbeau",
      "social_media": [{
        "github": "jrbourbeau"
      }]
    },
    {
      "name": "bnaul",
      "social_media": [{
        "github": "bnaul"
      }]
    },
    {
      "name": "icherniavska",
      "social_media": [{
        "github": "icherniavska"
      }]
    }
  ]
}
