{
  "name": "yorick",
  "title": "yorick",
  "description": "A project skeleton and boilerplate tool for quickly scaffolding new Python projects.",
  "logo_url": "https://github.com/excitedleigh.png",
  "repo_url": "https://github.com/adambrenecki/yorick",
  "bug_reports_url": "https://github.com/adambrenecki/yorick/issues",
  "pypi_url": "https://pypi.org/project/yorick/",
  "last_updated": "2012-11-16",
  "maintainers": [
    {
      "name": "Daisy Leigh Brenecki",
      "social_media": [{
        "github": "excitedleigh"
      }]
    }
  ]
}
