{
  "name": "oras",
  "title": "oras",
  "description": "Python SDK for OCI Registry as Storage (ORAS) — push and pull arbitrary artifacts to and from OCI registries.",
  "logo_url": "https://github.com/vsoch.png",
  "repo_url": "https://github.com/oras-project/oras-py",
  "bug_reports_url": "https://github.com/oras-project/oras-py/issues",
  "pypi_url": "https://pypi.org/project/oras/",
  "last_updated": "2026-03-09",
  "maintainers": [
    {
      "name": "Vanessa Sochat",
      "social_media": [{
        "github": "vsoch"
      }]
    }
  ]
}
